{
  "business_date": "02/17/2026",
  "parsed_date": "2026-02-17",
  "contracts": [
    {
      "metal": "Aluminum",
      "symbol": "ALI",
      "contract_name": "FEBRUARY 2026 ALUMINUM FUTURES",
      "contract_month": "FEB26",
      "daily_data": [
        {
          "date": "02/02/2026",
          "iso_date": "2026-02-02",
          "daily": 4,
          "cumulative": 4
        },
        {
          "date": "02/03/2026",
          "iso_date": "2026-02-03",
          "daily": 65,
          "cumulative": 69
        },
        {
          "date": "02/05/2026",
          "iso_date": "2026-02-05",
          "daily": 4,
          "cumulative": 73
        },
        {
          "date": "02/06/2026",
          "iso_date": "2026-02-06",
          "daily": 1,
          "cumulative": 74
        },
        {
          "date": "02/10/2026",
          "iso_date": "2026-02-10",
          "daily": 1,
          "cumulative": 75
        },
        {
          "date": "02/11/2026",
          "iso_date": "2026-02-11",
          "daily": 1,
          "cumulative": 76
        },
        {
          "date": "02/13/2026",
          "iso_date": "2026-02-13",
          "daily": 1,
          "cumulative": 77
        }
      ],
      "total_cumulative": 77
    },
    {
      "metal": "Gold",
      "symbol": "GC",
      "contract_name": "FEBRUARY 2026 COMEX 100 GOLD FUTURES",
      "contract_month": "FEB26",
      "daily_data": [
        {
          "date": "01/29/2026",
          "iso_date": "2026-01-29",
          "daily": 20484,
          "cumulative": 20484
        },
        {
          "date": "01/30/2026",
          "iso_date": "2026-01-30",
          "daily": 7036,
          "cumulative": 27520
        },
        {
          "date": "02/02/2026",
          "iso_date": "2026-02-02",
          "daily": 639,
          "cumulative": 28159
        },
        {
          "date": "02/03/2026",
          "iso_date": "2026-02-03",
          "daily": 1153,
          "cumulative": 29312
        },
        {
          "date": "02/04/2026",
          "iso_date": "2026-02-04",
          "daily": 2692,
          "cumulative": 32004
        },
        {
          "date": "02/05/2026",
          "iso_date": "2026-02-05",
          "daily": 498,
          "cumulative": 32502
        },
        {
          "date": "02/06/2026",
          "iso_date": "2026-02-06",
          "daily": 1114,
          "cumulative": 33616
        },
        {
          "date": "02/09/2026",
          "iso_date": "2026-02-09",
          "daily": 167,
          "cumulative": 33783
        },
        {
          "date": "02/10/2026",
          "iso_date": "2026-02-10",
          "daily": 176,
          "cumulative": 33959
        },
        {
          "date": "02/11/2026",
          "iso_date": "2026-02-11",
          "daily": 1477,
          "cumulative": 35436
        },
        {
          "date": "02/12/2026",
          "iso_date": "2026-02-12",
          "daily": 414,
          "cumulative": 35850
        },
        {
          "date": "02/13/2026",
          "iso_date": "2026-02-13",
          "daily": 242,
          "cumulative": 36092
        },
        {
          "date": "02/17/2026",
          "iso_date": "2026-02-17",
          "daily": 96,
          "cumulative": 36188
        }
      ],
      "total_cumulative": 36188
    },
    {
      "metal": "Copper",
      "symbol": "HG",
      "contract_name": "FEBRUARY 2026 COMEX COPPER FUTURES",
      "contract_month": "FEB26",
      "daily_data": [
        {
          "date": "01/29/2026",
          "iso_date": "2026-01-29",
          "daily": 2976,
          "cumulative": 2976
        },
        {
          "date": "01/30/2026",
          "iso_date": "2026-01-30",
          "daily": 1544,
          "cumulative": 4520
        },
        {
          "date": "02/02/2026",
          "iso_date": "2026-02-02",
          "daily": 607,
          "cumulative": 5127
        },
        {
          "date": "02/03/2026",
          "iso_date": "2026-02-03",
          "daily": 323,
          "cumulative": 5450
        },
        {
          "date": "02/04/2026",
          "iso_date": "2026-02-04",
          "daily": 439,
          "cumulative": 5889
        },
        {
          "date": "02/05/2026",
          "iso_date": "2026-02-05",
          "daily": 610,
          "cumulative": 6499
        },
        {
          "date": "02/06/2026",
          "iso_date": "2026-02-06",
          "daily": 309,
          "cumulative": 6808
        },
        {
          "date": "02/09/2026",
          "iso_date": "2026-02-09",
          "daily": 290,
          "cumulative": 7098
        },
        {
          "date": "02/10/2026",
          "iso_date": "2026-02-10",
          "daily": 181,
          "cumulative": 7279
        },
        {
          "date": "02/11/2026",
          "iso_date": "2026-02-11",
          "daily": 166,
          "cumulative": 7445
        },
        {
          "date": "02/12/2026",
          "iso_date": "2026-02-12",
          "daily": 338,
          "cumulative": 7783
        },
        {
          "date": "02/13/2026",
          "iso_date": "2026-02-13",
          "daily": 891,
          "cumulative": 8674
        },
        {
          "date": "02/17/2026",
          "iso_date": "2026-02-17",
          "daily": 560,
          "cumulative": 9234
        }
      ],
      "total_cumulative": 9234
    },
    {
      "metal": "Silver",
      "symbol": "SI",
      "contract_name": "FEBRUARY 2026 COMEX 5000 SILVER FUTURES",
      "contract_month": "FEB26",
      "daily_data": [
        {
          "date": "01/29/2026",
          "iso_date": "2026-01-29",
          "daily": 1881,
          "cumulative": 1881
        },
        {
          "date": "01/30/2026",
          "iso_date": "2026-01-30",
          "daily": 633,
          "cumulative": 2514
        },
        {
          "date": "02/02/2026",
          "iso_date": "2026-02-02",
          "daily": 251,
          "cumulative": 2765
        },
        {
          "date": "02/03/2026",
          "iso_date": "2026-02-03",
          "daily": 190,
          "cumulative": 2955
        },
        {
          "date": "02/04/2026",
          "iso_date": "2026-02-04",
          "daily": 608,
          "cumulative": 3563
        },
        {
          "date": "02/05/2026",
          "iso_date": "2026-02-05",
          "daily": 181,
          "cumulative": 3744
        },
        {
          "date": "02/06/2026",
          "iso_date": "2026-02-06",
          "daily": 317,
          "cumulative": 4061
        },
        {
          "date": "02/09/2026",
          "iso_date": "2026-02-09",
          "daily": 429,
          "cumulative": 4490
        },
        {
          "date": "02/10/2026",
          "iso_date": "2026-02-10",
          "daily": 102,
          "cumulative": 4592
        },
        {
          "date": "02/11/2026",
          "iso_date": "2026-02-11",
          "daily": 3,
          "cumulative": 4595
        },
        {
          "date": "02/17/2026",
          "iso_date": "2026-02-17",
          "daily": 29,
          "cumulative": 4624
        }
      ],
      "total_cumulative": 4624
    },
    {
      "metal": "Palladium",
      "symbol": "PA",
      "contract_name": "FEBRUARY 2026 PALLADIUM FUTURES NYMEX",
      "contract_month": "FEB26",
      "daily_data": [
        {
          "date": "01/29/2026",
          "iso_date": "2026-01-29",
          "daily": 14,
          "cumulative": 14
        },
        {
          "date": "01/30/2026",
          "iso_date": "2026-01-30",
          "daily": 12,
          "cumulative": 26
        },
        {
          "date": "02/02/2026",
          "iso_date": "2026-02-02",
          "daily": 61,
          "cumulative": 87
        },
        {
          "date": "02/06/2026",
          "iso_date": "2026-02-06",
          "daily": 4,
          "cumulative": 91
        },
        {
          "date": "02/09/2026",
          "iso_date": "2026-02-09",
          "daily": 1,
          "cumulative": 92
        },
        {
          "date": "02/13/2026",
          "iso_date": "2026-02-13",
          "daily": 13,
          "cumulative": 105
        },
        {
          "date": "02/17/2026",
          "iso_date": "2026-02-17",
          "daily": 7,
          "cumulative": 112
        }
      ],
      "total_cumulative": 112
    },
    {
      "metal": "Platinum",
      "symbol": "PL",
      "contract_name": "FEBRUARY 2026 PLATINUM FUTURES NYMEX",
      "contract_month": "FEB26",
      "daily_data": [
        {
          "date": "01/29/2026",
          "iso_date": "2026-01-29",
          "daily": 166,
          "cumulative": 166
        },
        {
          "date": "01/30/2026",
          "iso_date": "2026-01-30",
          "daily": 14,
          "cumulative": 180
        },
        {
          "date": "02/02/2026",
          "iso_date": "2026-02-02",
          "daily": 97,
          "cumulative": 277
        },
        {
          "date": "02/03/2026",
          "iso_date": "2026-02-03",
          "daily": 95,
          "cumulative": 372
        },
        {
          "date": "02/04/2026",
          "iso_date": "2026-02-04",
          "daily": 55,
          "cumulative": 427
        },
        {
          "date": "02/05/2026",
          "iso_date": "2026-02-05",
          "daily": 28,
          "cumulative": 455
        },
        {
          "date": "02/06/2026",
          "iso_date": "2026-02-06",
          "daily": 10,
          "cumulative": 465
        },
        {
          "date": "02/09/2026",
          "iso_date": "2026-02-09",
          "daily": 20,
          "cumulative": 485
        }
      ],
      "total_cumulative": 485
    }
  ],
  "last_updated": "2026-02-17T23:43:25.584111"
}